<?xml encoding="UTF-8"?>

<!ELEMENT BUNDLE (COMMON,LOCALE*)>
<!ELEMENT LOCALE (RESOURCE)*>
<!ELEMENT RESOURCE (#PCDATA)>
<!ELEMENT COMMON (RESOURCE)*>
<!ATTLIST RESOURCE
    name    CDATA #REQUIRED>
<!ATTLIST LOCALE
    lang    CDATA #REQUIRED>
<!ATTLIST BUNDLE
    default CDATA #REQUIRED>